[
  {
    "dataset": "pix_in_adhesion",
    "source_record_id": "pix_in_adhesion:1",
    "ispb": "58367961",
    "cnpj": "58367961000119",
    "institution_name": "BIT SCD S.A.",
    "short_name": "BIT SCD S.A.",
    "institution_type": "Sociedade de Crédito Direto",
    "spi_participation_type": "Direta",
    "pix_participation_type": "Facultativa",
    "pix_participation_mode": "Provedor de Conta Transacional",
    "is_authorized_by_bcb": true,
    "catalog_snapshot_date": "2026-04-12",
    "source_registry_id": "bcb-pix-in-adhesion",
    "source_file_url": "https://www.bcb.gov.br/content/estabilidadefinanceira/participantes_pix/lista-participantes-instituicoes-em-adesao-pix-20260410.csv",
    "source_publication_date": "2026-04-10",
    "raw_source_json": "{\"row_number\":\"1\",\"nome_reduzido\":\"BIT SCD S.A.\",\"ispb\":\"58367961\",\"cnpj\":\"58.367.961/0001-19\",\"tipo_instituicao\":\"Sociedade de Crédito Direto\",\"autorizada_pelo_bcb\":\"Sim\",\"tipo_participacao_spi\":\"Direta\",\"tipo_participacao_pix\":\"Facultativa\",\"modalidade_participacao_pix\":\"Provedor de Conta Transacional\",\"adhesion_status\":\"Ativo em operação restrita\"}",
    "schema_version": "1.0.0",
    "adhesion_status": "Ativo em operação restrita"
  },
  {
    "dataset": "pix_in_adhesion",
    "source_record_id": "pix_in_adhesion:2",
    "ispb": "07115294",
    "cnpj": "07115294000146",
    "institution_name": "BOKU NETWORK BRASIL IP",
    "short_name": "BOKU NETWORK BRASIL IP",
    "institution_type": "Instituição de Pagamento",
    "spi_participation_type": "Indireta",
    "pix_participation_type": "Facultativa",
    "pix_participation_mode": "Provedor de Conta Transacional",
    "is_authorized_by_bcb": true,
    "catalog_snapshot_date": "2026-04-12",
    "source_registry_id": "bcb-pix-in-adhesion",
    "source_file_url": "https://www.bcb.gov.br/content/estabilidadefinanceira/participantes_pix/lista-participantes-instituicoes-em-adesao-pix-20260410.csv",
    "source_publication_date": "2026-04-10",
    "raw_source_json": "{\"row_number\":\"2\",\"nome_reduzido\":\"BOKU NETWORK BRASIL IP\",\"ispb\":\"07115294\",\"cnpj\":\"07.115.294/0001-46\",\"tipo_instituicao\":\"Instituição de Pagamento\",\"autorizada_pelo_bcb\":\"Sim\",\"tipo_participacao_spi\":\"Indireta\",\"tipo_participacao_pix\":\"Facultativa\",\"modalidade_participacao_pix\":\"Provedor de Conta Transacional\",\"adhesion_status\":\"Ativo em operação restrita\"}",
    "schema_version": "1.0.0",
    "adhesion_status": "Ativo em operação restrita"
  },
  {
    "dataset": "pix_in_adhesion",
    "source_record_id": "pix_in_adhesion:3",
    "ispb": "08422119",
    "cnpj": "08422119000164",
    "institution_name": "BULLLA IP S.A.",
    "short_name": "BULLLA IP S.A.",
    "institution_type": "Instituição de Pagamento",
    "spi_participation_type": "Indireta",
    "pix_participation_type": "Obrigatória",
    "pix_participation_mode": "Provedor de Conta Transacional",
    "is_authorized_by_bcb": true,
    "catalog_snapshot_date": "2026-04-12",
    "source_registry_id": "bcb-pix-in-adhesion",
    "source_file_url": "https://www.bcb.gov.br/content/estabilidadefinanceira/participantes_pix/lista-participantes-instituicoes-em-adesao-pix-20260410.csv",
    "source_publication_date": "2026-04-10",
    "raw_source_json": "{\"row_number\":\"3\",\"nome_reduzido\":\"BULLLA IP S.A.\",\"ispb\":\"08422119\",\"cnpj\":\"08.422.119/0001-64\",\"tipo_instituicao\":\"Instituição de Pagamento\",\"autorizada_pelo_bcb\":\"Sim\",\"tipo_participacao_spi\":\"Indireta\",\"tipo_participacao_pix\":\"Obrigatória\",\"modalidade_participacao_pix\":\"Provedor de Conta Transacional\",\"adhesion_status\":\"Etapa Homologatória\"}",
    "schema_version": "1.0.0",
    "adhesion_status": "Etapa Homologatória"
  },
  {
    "dataset": "pix_in_adhesion",
    "source_record_id": "pix_in_adhesion:4",
    "ispb": "39696395",
    "cnpj": "39696395000144",
    "institution_name": "CACTVS IP S.A.",
    "short_name": "CACTVS IP S.A.",
    "institution_type": "Instituição de Pagamento",
    "spi_participation_type": "Direta",
    "pix_participation_type": "Facultativa",
    "pix_participation_mode": "Provedor de Conta Transacional",
    "is_authorized_by_bcb": true,
    "catalog_snapshot_date": "2026-04-12",
    "source_registry_id": "bcb-pix-in-adhesion",
    "source_file_url": "https://www.bcb.gov.br/content/estabilidadefinanceira/participantes_pix/lista-participantes-instituicoes-em-adesao-pix-20260410.csv",
    "source_publication_date": "2026-04-10",
    "raw_source_json": "{\"row_number\":\"4\",\"nome_reduzido\":\"CACTVS IP S.A.\",\"ispb\":\"39696395\",\"cnpj\":\"39.696.395/0001-44\",\"tipo_instituicao\":\"Instituição de Pagamento\",\"autorizada_pelo_bcb\":\"Sim\",\"tipo_participacao_spi\":\"Direta\",\"tipo_participacao_pix\":\"Facultativa\",\"modalidade_participacao_pix\":\"Provedor de Conta Transacional\",\"adhesion_status\":\"Etapa Homologatória\"}",
    "schema_version": "1.0.0",
    "adhesion_status": "Etapa Homologatória"
  },
  {
    "dataset": "pix_in_adhesion",
    "source_record_id": "pix_in_adhesion:5",
    "ispb": "53720128",
    "cnpj": "53720128000196",
    "institution_name": "CONTA SIMPLES SCD S.A.",
    "short_name": "CONTA SIMPLES SCD S.A.",
    "institution_type": "Sociedade de Crédito Direto",
    "spi_participation_type": "Indireta",
    "pix_participation_type": "Facultativa",
    "pix_participation_mode": "Provedor de Conta Transacional",
    "is_authorized_by_bcb": true,
    "catalog_snapshot_date": "2026-04-12",
    "source_registry_id": "bcb-pix-in-adhesion",
    "source_file_url": "https://www.bcb.gov.br/content/estabilidadefinanceira/participantes_pix/lista-participantes-instituicoes-em-adesao-pix-20260410.csv",
    "source_publication_date": "2026-04-10",
    "raw_source_json": "{\"row_number\":\"5\",\"nome_reduzido\":\"CONTA SIMPLES SCD S.A.\",\"ispb\":\"53720128\",\"cnpj\":\"53.720.128/0001-96\",\"tipo_instituicao\":\"Sociedade de Crédito Direto\",\"autorizada_pelo_bcb\":\"Sim\",\"tipo_participacao_spi\":\"Indireta\",\"tipo_participacao_pix\":\"Facultativa\",\"modalidade_participacao_pix\":\"Provedor de Conta Transacional\",\"adhesion_status\":\"Etapa Homologatória\"}",
    "schema_version": "1.0.0",
    "adhesion_status": "Etapa Homologatória"
  },
  {
    "dataset": "pix_in_adhesion",
    "source_record_id": "pix_in_adhesion:6",
    "ispb": "41146382",
    "cnpj": "41146382000143",
    "institution_name": "COOPERLEGIS",
    "short_name": "COOPERLEGIS",
    "institution_type": "Cooperativa de Crédito",
    "spi_participation_type": "Indireta",
    "pix_participation_type": "Facultativa",
    "pix_participation_mode": "Provedor de Conta Transacional",
    "is_authorized_by_bcb": true,
    "catalog_snapshot_date": "2026-04-12",
    "source_registry_id": "bcb-pix-in-adhesion",
    "source_file_url": "https://www.bcb.gov.br/content/estabilidadefinanceira/participantes_pix/lista-participantes-instituicoes-em-adesao-pix-20260410.csv",
    "source_publication_date": "2026-04-10",
    "raw_source_json": "{\"row_number\":\"6\",\"nome_reduzido\":\"COOPERLEGIS\",\"ispb\":\"41146382\",\"cnpj\":\"41.146.382/0001-43\",\"tipo_instituicao\":\"Cooperativa de Crédito\",\"autorizada_pelo_bcb\":\"Sim\",\"tipo_participacao_spi\":\"Indireta\",\"tipo_participacao_pix\":\"Facultativa\",\"modalidade_participacao_pix\":\"Provedor de Conta Transacional\",\"adhesion_status\":\"Etapa Homologatória\"}",
    "schema_version": "1.0.0",
    "adhesion_status": "Etapa Homologatória"
  },
  {
    "dataset": "pix_in_adhesion",
    "source_record_id": "pix_in_adhesion:7",
    "ispb": "55823094",
    "cnpj": "55823094000190",
    "institution_name": "DELTA GLOBAL SCD S.A.",
    "short_name": "DELTA GLOBAL SCD S.A.",
    "institution_type": "Sociedade de Crédito Direto",
    "spi_participation_type": "Direta",
    "pix_participation_type": "Facultativa",
    "pix_participation_mode": "Provedor de Conta Transacional",
    "is_authorized_by_bcb": true,
    "catalog_snapshot_date": "2026-04-12",
    "source_registry_id": "bcb-pix-in-adhesion",
    "source_file_url": "https://www.bcb.gov.br/content/estabilidadefinanceira/participantes_pix/lista-participantes-instituicoes-em-adesao-pix-20260410.csv",
    "source_publication_date": "2026-04-10",
    "raw_source_json": "{\"row_number\":\"7\",\"nome_reduzido\":\"DELTA GLOBAL SCD S.A.\",\"ispb\":\"55823094\",\"cnpj\":\"55.823.094/0001-90\",\"tipo_instituicao\":\"Sociedade de Crédito Direto\",\"autorizada_pelo_bcb\":\"Sim\",\"tipo_participacao_spi\":\"Direta\",\"tipo_participacao_pix\":\"Facultativa\",\"modalidade_participacao_pix\":\"Provedor de Conta Transacional\",\"adhesion_status\":\"Ativo em operação restrita\"}",
    "schema_version": "1.0.0",
    "adhesion_status": "Ativo em operação restrita"
  },
  {
    "dataset": "pix_in_adhesion",
    "source_record_id": "pix_in_adhesion:8",
    "ispb": "44663846",
    "cnpj": "44663846000187",
    "institution_name": "FEATBANK IP LTDA",
    "short_name": "FEATBANK IP LTDA",
    "institution_type": "Instituição de Pagamento",
    "spi_participation_type": "Direta",
    "pix_participation_type": "Facultativa",
    "pix_participation_mode": "Provedor de Conta Transacional",
    "is_authorized_by_bcb": true,
    "catalog_snapshot_date": "2026-04-12",
    "source_registry_id": "bcb-pix-in-adhesion",
    "source_file_url": "https://www.bcb.gov.br/content/estabilidadefinanceira/participantes_pix/lista-participantes-instituicoes-em-adesao-pix-20260410.csv",
    "source_publication_date": "2026-04-10",
    "raw_source_json": "{\"row_number\":\"8\",\"nome_reduzido\":\"FEATBANK IP LTDA\",\"ispb\":\"44663846\",\"cnpj\":\"44.663.846/0001-87\",\"tipo_instituicao\":\"Instituição de Pagamento\",\"autorizada_pelo_bcb\":\"Sim\",\"tipo_participacao_spi\":\"Direta\",\"tipo_participacao_pix\":\"Facultativa\",\"modalidade_participacao_pix\":\"Provedor de Conta Transacional\",\"adhesion_status\":\"Etapa Homologatória\"}",
    "schema_version": "1.0.0",